id,title,score,num_comments,author,created_utc,url,over_18,edited,spoiler,stickied
1et17ur,"I get bored once we reach the ""mature"" stage. Help.",85,22,ntdoyfanboy,2024-08-15 17:34:36,https://www.reddit.com/r/dataengineering/comments/1et17ur/i_get_bored_once_we_reach_the_mature_stage_help/,False,False,False,False
1est8pl,Best way to build a Small Data Lake? (<100GB),56,54,2minutestreaming,2024-08-15 11:55:35,https://www.reddit.com/r/dataengineering/comments/1est8pl/best_way_to_build_a_small_data_lake_100gb/,False,False,False,False
1esqc5z,Does Data Engineering Matter for Startups?,31,25,No-Sympathy9824,2024-08-15 08:53:02,https://www.reddit.com/r/dataengineering/comments/1esqc5z/does_data_engineering_matter_for_startups/,False,False,False,False
1esszbv,"If you’re using dbt for transformations, what data viz tool does your org use?",20,30,Rajsuomi,2024-08-15 11:41:35,https://www.reddit.com/r/dataengineering/comments/1esszbv/if_youre_using_dbt_for_transformations_what_data/,False,False,False,False
1et2pzc,The 6 Key Components of a Data Streaming Platform [Lightboard Video],9,3,adambellemare,2024-08-15 18:34:48,https://youtu.be/hrB71pMVjpw,False,False,False,False
1et5f9l,When noboby listens,6,11,Alone_Face_2949,2024-08-15 20:21:54,https://www.reddit.com/r/dataengineering/comments/1et5f9l/when_noboby_listens/,False,False,False,False
1eswldu,When it's time to upgrade from SharePoint Online to a more elegant database?,8,13,Ceborn,2024-08-15 14:27:31,https://www.reddit.com/r/dataengineering/comments/1eswldu/when_its_time_to_upgrade_from_sharepoint_online/,False,False,False,False
1eswzyv,Data modelling recommendation starwars api,4,2,No-Conversation476,2024-08-15 14:43:47,https://www.reddit.com/r/dataengineering/comments/1eswzyv/data_modelling_recommendation_starwars_api/,False,False,False,False
1esib05,"jsonlines in spark, scala udf",6,8,bcsamsquanch,2024-08-15 01:09:22,https://www.reddit.com/r/dataengineering/comments/1esib05/jsonlines_in_spark_scala_udf/,False,False,False,False
1esxs7u,Anyone attending the dbt Coalesce conference this year?,5,3,MasterKluch,2024-08-15 15:15:32,https://www.reddit.com/r/dataengineering/comments/1esxs7u/anyone_attending_the_dbt_coalesce_conference_this/,False,False,False,False
1esut7g,Exposing Data for Customers,5,5,onmywaytostealyagirl,2024-08-15 13:11:44,https://www.reddit.com/r/dataengineering/comments/1esut7g/exposing_data_for_customers/,False,False,False,False
1et89lu,Dbt contract enforcement of source tables,5,0,Bootlegcrunch,2024-08-15 22:19:09,https://www.reddit.com/r/dataengineering/comments/1et89lu/dbt_contract_enforcement_of_source_tables/,False,False,False,False
1et1ljx,Mariadb crashes after large queries ,5,8,Luemas91,2024-08-15 17:50:05,https://www.reddit.com/r/dataengineering/comments/1et1ljx/mariadb_crashes_after_large_queries/,False,False,False,False
1et0m9n,Efficient replacement for Pyspark Union,3,14,Easy-Experience6270,2024-08-15 17:10:29,https://www.reddit.com/r/dataengineering/comments/1et0m9n/efficient_replacement_for_pyspark_union/,False,False,False,False
1esz5fz,explain the final steps after the data catalog please,2,0,jimbochong,2024-08-15 16:10:24,https://www.reddit.com/r/dataengineering/comments/1esz5fz/explain_the_final_steps_after_the_data_catalog/,False,False,False,False
1esmgne,Any idea for AWS data platform project with some other data tools out there intergrated ?,4,2,Tuan_coder,2024-08-15 04:39:35,https://www.reddit.com/r/dataengineering/comments/1esmgne/any_idea_for_aws_data_platform_project_with_some/,False,False,False,False
1et6ujy,Data pipeline orchestration (beginner),3,3,WestIndication5866,2024-08-15 21:20:01,https://www.reddit.com/r/dataengineering/comments/1et6ujy/data_pipeline_orchestration_beginner/,False,False,False,False
1et6jdb,Data staging: temp or permanent? ,3,5,forgael,2024-08-15 21:07:16,https://www.reddit.com/r/dataengineering/comments/1et6jdb/data_staging_temp_or_permanent/,False,False,False,False
1et84gv,I built an API that parses unstructured documents into structured JSON. Would love your feedback.,3,5,dhj9817,2024-08-15 22:13:04,https://www.reddit.com/r/dataengineering/comments/1et84gv/i_built_an_api_that_parses_unstructured_documents/,False,False,False,False
1esoazf,What do you think about automating data requests from non-technical people?,4,5,B7456-A5,2024-08-15 06:33:41,https://www.reddit.com/r/dataengineering/comments/1esoazf/what_do_you_think_about_automating_data_requests/,False,False,False,False
1esmezg,"Help: Seeking Advice on Optimizing Data Pipeline for Sentiment Analysis, NER Tagging, and Custom AI/ML Workflows",2,1,Unstable007,2024-08-15 04:36:58,https://www.reddit.com/r/dataengineering/comments/1esmezg/help_seeking_advice_on_optimizing_data_pipeline/,False,False,False,False
1et6asf,Learn Data Engineering opinions?,2,1,imatiasmb,2024-08-15 20:57:47,https://www.reddit.com/r/dataengineering/comments/1et6asf/learn_data_engineering_opinions/,False,False,False,False
1esocsy,Open source data pipelines,3,3,Aggressive-Bee-8748,2024-08-15 06:37:08,https://www.reddit.com/r/dataengineering/comments/1esocsy/open_source_data_pipelines/,False,False,False,False
1esnk9i,Machine learning with Airflow,1,2,unmasked_crusader,2024-08-15 05:45:56,https://www.reddit.com/r/dataengineering/comments/1esnk9i/machine_learning_with_airflow/,False,False,False,False
1esrc88,Airbnb Data Tech Stack,0,1,mjfnd,2024-08-15 10:02:00,https://www.junaideffendi.com/p/airbnb-data-tech-stack?r=cqjft&utm_campaign=post&utm_medium=web,False,False,False,False
